<?xml version="1.0" encoding="UTF-8"?>
<mapStorage xmlns="https://uwlib-cams.github.io/map_storage/"
    xmlns:xsi="http://www.w3.org/2001/XMLSchema-instance"
    xmlns:xs="http://www.w3.org/2001/XMLSchema"
    xmlns:rdf="http://www.w3.org/1999/02/22-rdf-syntax-ns#"
    xmlns:reg="http://metadataregistry.org/uri/profile/regap/"
    xmlns:rdfs="http://www.w3.org/2000/01/rdf-schema#"
    xsi:schemaLocation="https://uwlib-cams.github.io/map_storage/ https://uwlib-cams.github.io/map_storage/map_storage.xsd">
    <mapid_institution>WAU</mapid_institution>
    <propSet>
        <mapid_propSet>rda_Work</mapid_propSet>
        <prop>
            <prop_iri iri="http://example.com/property_001"/>
            <prop_label xml:lang="eng">has basket weaver</prop_label>
            <prop_domain iri="http://example.com/class_001"/>
            <prop_range iri="http://example.com/class_002"/>
        </prop>
    </propSet>
</mapStorage>
